{
  "candidates": 293,
  "entry": "c10",
  "files": [
    {
      "language": "solidity",
      "path": "packages/contracts-bedrock/src/L1/OPContractsManagerStandardValidator.sol",
      "renamed_sha256": "66aa2656ef9a85b10f33a10f6f97c0c99ee83416fd86527b73bf67fb7b18e379",
      "sha256": "05088fd915fc704faf0b32a37a595c2576778920134656d68754d1fcd8c40ee2"
    },
    {
      "language": "solidity",
      "path": "packages/contracts-bedrock/src/L1/opcm/StandardValidatorUtils.sol",
      "renamed_sha256": "03743df9e4631e4fced50c701897e75801d82dd7dc5c06eeb6483b3db1cd12b4",
      "sha256": "99b00624e396ad7a94e27889b741c49e240eae47deb73902306cae885ca4407f"
    }
  ],
  "files_by_ast": 2,
  "files_by_tokens": 0,
  "isomorphic": true,
  "map_sha256": "032d6ccdfec51bb37c33d5070210cc41b98eaaa5637bf63d0e6c61b73f42545c",
  "on_changed_lines": 0,
  "renamed": 44,
  "roundtrip": true,
  "seed": "c10"
}
