{
  "candidates": 310,
  "entry": "c08",
  "files": [
    {
      "language": "go",
      "path": "x/group/keeper/msg_server.go",
      "renamed_sha256": "8a3aeee9c28a386f6c1cae635f996472f3d2c124b475c2f15a5c4880c6b4f9f7",
      "sha256": "a8ee7774235a2c6d8ef2377c8f672db5e8fdb006c1c14a92c08229247474793e"
    }
  ],
  "files_by_ast": 1,
  "files_by_tokens": 0,
  "isomorphic": true,
  "map_sha256": "6c3f3aed5743cc1811d54c0cba9458b7d709519fa4c3874fc6cd0425b409482a",
  "on_changed_lines": 0,
  "renamed": 34,
  "roundtrip": true,
  "seed": "c08"
}
