{
  "candidates": 198,
  "entry": "c17",
  "files": [
    {
      "language": "solidity",
      "path": "src/osp/OneStepProverHostIo.sol",
      "renamed_sha256": "e68fbe45034d89d22ef3973e8110302e9b661f8f26d8cf8fc13bbfa110ffcbce",
      "sha256": "552b337b4ffe1df1ed7c9840be86d3266367fda6094a2b8281eecd77e88c0509"
    }
  ],
  "files_by_ast": 1,
  "files_by_tokens": 0,
  "isomorphic": true,
  "map_sha256": "ec93d2b0c1118763521618add6347ee40017c723bf77d705b1145cf7638af47b",
  "on_changed_lines": 0,
  "renamed": 55,
  "roundtrip": true,
  "seed": "c17"
}
